{
  "$schema": "../../_schema/deck.schema.json",
  "schemaVersion": 1,
  "slug": "hsk-1-3-vocabulary",
  "title": "HSK 1~3급 600단어 예문",
  "summary": "HSK 1~3급 필수 어휘 600개를 뜻, 병음, 한자 풀이, 예문, 음성과 함께 복습하는 Anki 덱입니다.",
  "category": "language",
  "kind": "vocabulary",
  "exam": {
    "name": "HSK",
    "provider": "Chinese Proficiency Test",
    "scope": [
      "1급",
      "2급",
      "3급"
    ]
  },
  "language": "ko",
  "license": "CC BY-NC-SA 4.0",
  "maintainers": [
    "@Enceladus-X"
  ],
  "links": [],
  "versions": [
    {
      "version": "2026.06",
      "releasedAt": "2026-06-14",
      "changes": "HSK 1~3급 어휘 600개, 한국어 뜻, 병음, 한자 풀이, 예문, 음성을 포함한 첫 공개 배포입니다.",
      "stats": {
        "cards": 600,
        "notes": 600,
        "media": 1181
      },
      "apkg": {
        "assetName": "hsk-1-3-600-vocabulary-examples.apkg",
        "downloadUrl": "https://github.com/Enceladus-X/deckhub/releases/download/hsk-1-3-vocabulary-v2026.06/hsk-1-3-600-vocabulary-examples.apkg",
        "sha256": "bd02b7d4b82e3164c5a94a28c5a25edd4ab8a5c1862648c0899552b166f594f7",
        "sizeBytes": 17392158
      },
      "segments": [
        {
          "id": "level-1",
          "label": "1급",
          "scope": [
            "HSK 1급"
          ],
          "cards": 150
        },
        {
          "id": "level-2",
          "label": "2급",
          "scope": [
            "HSK 2급"
          ],
          "cards": 150
        },
        {
          "id": "level-3",
          "label": "3급",
          "scope": [
            "HSK 3급"
          ],
          "cards": 300
        }
      ],
      "noteTypes": [
        {
          "name": "HSK",
          "fields": [
            "Word",
            "MeaningKo",
            "Pinyin",
            "HanziBreakdown",
            "ExampleZh",
            "ExampleKo",
            "ExamplePinyin",
            "WordAudio",
            "ExampleAudio"
          ],
          "templates": [
            {
              "name": "Card 1"
            }
          ],
          "notes": 600,
          "cards": 600
        }
      ]
    }
  ]
}
